[
  {
    "keywords": "stylishly, affordable, small family, working bachelors, prime location, secure neighborhood",
    "city": "Dubai",
    "locality": "Dubai Creek Harbour",
    "area": 516,
    "area_unit": "Square Feet",
    "price": 25000001,
    "furnishing": "Semi-Furnished",
    "bedrooms": 3,
    "property_age": "10 years",
    "bathrooms": 2,
    "parking": 1,
    "facing": "garden",
    "floor_number": 9,
    "total_floor_count": 10,
    "amenities": "cycling cum jogging track, playing zone for children, large green zone and 24 hour security",
    "description": "A stylishly designed flat is available with 516 square feet of space and at a price of AED 2,50,00,001 which is quite affordable. You will get 3 bedroom at the apartment along with 2 bathrooms as well and 1 parking making it suitable for a small family, working bachelors. The prime location of Dubai Creek Harbour in Dubai is a key feature for the property since it is located close to public transportation in a safe & secure neighborhood. This is a garden facing apartment with a nice view on the 9th floor of a 10 storied building and is 10+ years old while being semi-furnished. Community amenities include a cycling cum jogging track, playing zone for children, large green zone and 24 hour security."
  },
  {
    "keywords": "spacious, prime, competitive, family, public transportation",
    "city": "Sharjah",
    "locality": "Maryam Island",
    "area": 870,
    "area_unit": "Square Feet",
    "price": 4800000011,
    "furnishing": "Furnished",
    "bedrooms": 4,
    "property_age": "5-7 years",
    "bathrooms": 3,
    "parking": 2,
    "facing": "north west",
    "floor_number": 10,
    "total_floor_count": 20,
    "amenities": "24-hour security services, playing zones for children, power backup",
    "description": "Enjoy buying spacious 870 square feet apartment in a prime location at a competitive price of AED 4,80,00,00,011. Residents will enjoy 4 bedrooms, 3 bathrooms and 2 parking facility at this property, making it suitable for family. The property lies close to public transportation in Maryam Island, one of Sharjah's poshest localities. This stylishly designed property faces the north west while being 5-7 years old and lies on the 10th floor of a 20 storied building. It is a furnished unit. Amenities available in this apartment includes 24-hour security services, playing zones for children, power backup and more."
  },
  {
    "keywords": "beautifully, breakthrough, well-ventilated, public transportation, family",
    "city": "Ajman",
    "locality": "Emirates City",
    "area": 1730,
    "area_unit": "Square Feet",
    "price": 1850000,
    "furnishing": "Furnished",
    "bedrooms": 1.5,
    "property_age": "2-4 years",
    "bathrooms": 1,
    "parking": 2,
    "facing": "west",
    "floor_number": 14,
    "total_floor_count": 21,
    "amenities": "power backup, 24 hour security services, medical facilities",
    "description": "You can snap up this beautifully designed apartment with 1730 square feet in terms of area, at a breakthrough price of AED 18,50,000. This well-ventilated apartment comes with 1.5 bedrooms, 1 bathrooms and 2 parking facility, being ideal for a family. The prime location of Emirates City, Ajman is a big plus point for this property since it is close to public transportation. 2-4 years old, this property faces the west while offering a nice view to residents on the 14th floor of a 21 storied building. It is furnished for maximum comfort. You can expect power backup and 24 hour security services for the apartment along with medical facilities."
  },
  {
    "keywords": "spacious, luxurious, well-ventilated, gated community, safe & secure",
    "city": "Dubai",
    "locality": "Jumeirah Village Circle",
    "area": 1650,
    "area_unit": "Square Feet",
    "price": 2222244553,
    "furnishing": "Semi-Furnished",
    "bedrooms": 4,
    "property_age": "2-4 years",
    "bathrooms": 3,
    "parking": 1,
    "facing": "east",
    "floor_number": 4,
    "total_floor_count": 15,
    "amenities": "badminton court, 24-hour security, attached market, daycare center, club house, gymnasium, indoor games, power backup, squash court, swimming pool, tennis court",
    "description": "This spacious and luxurious flat is available for a competitive price of AED 2,22,22,44,553 with area of 1650 square feet. The well-ventilated and stylishly designed property comes with 4 bedrooms, 3 bathrooms and 1 parking slots, making it a great option for families. The property is part of a well-known gated community in a safe & secure neighborhood at the rapidly growing Jumeirah Village Circle in Dubai. The semi-furnished apartment faces east and is 2-4 years old while being housed on the 4th floor in a 15 floor building. There are plenty of amenities at the project including a badminton court, 24-hour security, attached market, daycare center, club house, gymnasium, indoor games, power backup, squash court, swimming pool, tennis court and more."
  }
]
