[
  {
    "keywords": "stylishly, affordable, small family, working bachelors, prime location, secure neighborhood",
    "city": "Mumbai",
    "locality": "Goregaon West",
    "area": 516,
    "area_unit": "square feet",
    "price": 25000001,
    "furnishing": "semi-furnished",
    "bedrooms": 23,
    "property_age": "10 years",
    "bathrooms": 14,
    "parking": 7,
    "facing": "garden",
    "floor_number": 31,
    "total_floor_count": 46,
    "amenities": "cycling cum jogging track, playing zone for children, large green zone and 24 hour security",
    "description": "A stylishly designed flat is available with 516 square feet of space and at a price of Rs 2,50,00,001 which is quite affordable. You will get 23 bedroom at the apartment along with 14 bathrooms as well and 7 parking making it suitable for a small family, working bachelors. The prime location of Goregaon West in Mumbai is a key feature for the property since it is located close to public transportation in a safe & secure neighborhood. This is a garden facing apartment with a nice view on the 31 floor of a 46 storied building and is 10+ years old while being semi-furnished. Community amenities include a cycling cum jogging track, playing zone for children, large green zone and 24 hour security."
  },
  {
    "keywords": "spacious, prime, competitive, family, public transportation",
    "city": "Gurgaon",
    "locality": "Sector 45",
    "area": 870,
    "area_unit": "square feet",
    "price": 4800000011,
    "furnishing": "furnished",
    "bedrooms": 4,
    "property_age": "5-7 years",
    "bathrooms": 3,
    "parking": 2,
    "facing": "north west",
    "floor_number": 10,
    "total_floor_count": 20,
    "amenities": "24-hour security services, playing zones for children, power backup",
    "description": "Enjoy buying spacious 870 square feet apartment in a prime location at a competitive price of Rs 4,80,00,00,011. Residents will enjoy 4 bedrooms, 3 bathrooms and 2 parking facility at this property, making it suitable for family. The property lies close to public transportation in Sector 45, one of Gurgaon's poshest localities. This stylishly designed property faces the north west while being 5-7 years old and lies on the 10th floor of a 20 storied building. It is a furnished unit. Amenities available in this apartment includes 24-hour security services, playing zones for children, power backup and more."
  },
  {
    "keywords": "beautifully, breakthrough, well-ventilated, public transportation, family",
    "city": "Noida",
    "locality": "Sector 100",
    "area": 1730,
    "area_unit": "square feet",
    "price": 1850000,
    "furnishing": "furnished",
    "bedrooms": 9,
    "property_age": "2-4 years",
    "bathrooms": 5,
    "parking": 2,
    "facing": "west",
    "floor_number": 14,
    "total_floor_count": 21,
    "amenities": "power backup, 24 hour security services, medical facilities",
    "description": "You can snap up this beautifully designed apartment with 1730 square feet in terms of area, at a breakthrough price of Rs 18,50,000. This well-ventilated apartment comes with 9 bedrooms, 5 bathrooms and 2 parking facility, being ideal for a family. The prime location of sector 100, Noida is a big plus point for this property since it is close to public transportation. 2-4 years old, this property faces the west while offering a nice view to residents on the 14th floor of a 21 storied building. It is furnished for maximum comfort. You can expect power backup and 24 hour security services for the apartment along with medical facilities."
  },
  {
    "keywords": "spacious, luxurious, well-ventilated, gated community, safe & secure",
    "city": "Gurgaon",
    "locality": "Sector 102",
    "area": 1650,
    "area_unit": "square feet",
    "price": 2222244553,
    "furnishing": "semi-furnished",
    "bedrooms": 5,
    "property_age": "2-4 years",
    "bathrooms": 3,
    "parking": 2,
    "facing": "east",
    "floor_number": 4,
    "total_floor_count": 15,
    "amenities": "badminton court, 24-hour security, attached market, daycare center, club house, gymnasium, indoor games, power backup, squash court, swimming pool, tennis court",
    "description": "This spacious and luxurious flat is available for a competitive price of Rs 2,22,22,44,553 with area of 1650 square feet. The well-ventilated and stylishly designed property comes with 5 bedrooms, 3 bathrooms and 2 parking slots, making it a great option for families. The property is part of a well-known gated community in a safe & secure neighborhood at the rapidly growing Sector 102 in Gurgaon. The semi-furnished apartment faces east and is 2-4 years old while being housed on the 4th floor in a 15 floor building. There are plenty of amenities at the project including a badminton court, 24-hour security, attached market, daycare center, club house, gymnasium, indoor games, power backup, squash court, swimming pool, tennis court and more."
  }
]
