[
    {
        "keywords": "spacious, prime location, public transportation, safe & secure neighborhood",
        "city": "Mumbai",
        "locality": "Powai",
        "tower": "C",
        "area": 1025,
        "area_unit": "square feet",
        "price": 4000000,
        "furnishing": "furnished",
        "bedrooms": 2,
        "property_age": "5-7 years",
        "bathrooms": 2,
        "parking": 1,
        "facing": "garden",
        "floor_number": 6,
        "total_floor_count": 7,
        "amenities": "24 hour security, badminton court, inbuilt wardrobes, clubhouse, central air conditioning",
        "description": "Offering a 1025 square feet of space, spacious builder floor for a competitive sale price of Rs. 40,00,000. You will find 2 bedrooms, 2 bathrooms with this builder floor along with 1 parking facility. The property lies in Powai which is a prime location in Mumbai and is close to public transportation and which is a safe & secure neighborhood. This furnished property is a garden facing builder floor tower C on the 6th floor of a 7 storied building and this is 5-7 years old construction. This project has some of the best amenities which includes 24 hour security, badminton court, inbuilt wardrobes, clubhouse, central air conditioning."
    },
    {
        "keywords": "stylish, affordable, well-ventilated, prime location, bachelors, safe & secure",
        "city": "Mumbai",
        "locality": "Thane",
        "tower": "A",
        "Area": 640,
        "area_unit": "square feet",
        "price": 2300000,
        "furnishing": "semi-furnished",
        "bedrooms": 2,
        "property_age": "6 years",
        "bathrooms": 2,
        "parking": null,
        "facing": "north-east",
        "floor_number": 12,
        "total_floor_count": 26,
        "amenities": "24x7 security, cycle/jogging track, playing zones for children and visitors’ parking",
        "description": "Find a stylish and luxurious builder floor for sale at an affordable rate of Rs. 23,00,000 with total area of 640 square feet. This well ventilated property comes with 2 bedrooms, 2 bathrooms, making it suitable for bachelors. The property is situated at Thane, a prime location in Mumbai and in a safe & secure neighborhood. This is a semi-furnished, north-east facing property in Block A and is in 12th floor within a building that has 26 floors in all. It is 6 years old property. There are numerous amenities available including 24x7 security, cycle/jogging track, playing zones for children and visitors’ parking."
    },
    {
        "keywords": "well-ventilated, spacious, affordable, family, working bachelors",
        "city": "Noida",
        "locality": "Sector 100",
        "tower": "Tower A",
        "area": 1250,
        "area_unit": "square feet",
        "price": 1900000,
        "furnishing": "semi-furnished",
        "bedrooms": 5,
        "property_age": "5-7 years",
        "bathrooms": 3,
        "parking": 1,
        "facing": "east",
        "floor_number": 6,
        "total_floor_count": 10,
        "amenities": "jogging cum cycling track, playing zones for children, visitors’ parking, power backup",
        "description": "Experience a well-ventilated and spacious builder floor for sale with 1250 square feet in area, at an affordable sale price of Rs. 19,00,000. The stylishly designed property offers 5 bedrooms and 3 bathrooms along with a parking spot as well, making it suitable for a family or even for working bachelors. The property lies in a prime location of Sector 100 in Noida which is in a safe & secure locality. This property is semi-furnished and faces east while being housed in Tower A and is 5-7 years old. It is on 6th floor and has a total of 10 floors. Key amenities offered at the project include a jogging cum cycling track, playing zones for children, visitors’ parking, power backup and more."
    },
    {
        "keywords": "spacious, reasonable, prime, close to public transportation",
        "city": "Mumbai",
        "locality": "Santacruz West",
        "area": 850,
        "area_unit": "sq ft",
        "price": 5200000,
        "furnishing": "unfurnished",
        "bedrooms": 3,
        "property_age": "5-6 years",
        "bathrooms": 1,
        "parking": null,
        "facing": "west",
        "floor_number": 6,
        "total_floor_count": 7,
        "amenities": "pet area, visitors’ parking space, power backup, jogging cum cycling track",
        "description": "A great deal for buyers who will appreciate this spacious builder floor offering 850 sq ft of space at an reasonable sale price of Rs. 52,00,000. There are 3 bedrooms in tandem with 1 bathroom making it a really suitable property for bachelors. It does not include a parking spot. The luxurious property is in a prime location at Santacruz West in Mumbai, close to public transportation and has wide road. The unfurnished property which is 5-6 years old lies on the 6th floor of a building with 7 floors in total and is west facing. A pet area, visitors’ parking space, power backup and jogging cum cycling track are major amenities available here."
    }
]
