[
  {
    "keywords": "luxurious, spacious, family, prime location",
    "city": "Gurgaon",
    "locality": "Sushant Lok 1",
    "area": 1730,
    "area_unit": "Square Feet",
    "price": 340000,
    "furnishing": "Furnished",
    "bedrooms": 3,
    "property_age": "5-7 years",
    "bathrooms": 2,
    "parking": 1,
    "facing": "east",
    "Floor_number": 9,
    "total_floor_count": 16,
    "amenities": "medical facilities, a day care center, 24x7 security,water views",
    "description": "A luxurious builder floor is available for rent at Rs 3,40,000 with total area of 1730 square feet. The spacious property comes with 3 bedrooms, 2 bathrooms and 1 parking spots, making it ideal for family. The property is situated in the prime location of Sushant Lok 1 in Gurgaon. This is an east-facing property and is on 9th floor within a building with 16 floors in total. The age of the property is 5-7 years. It is a furnished property with all essential appliances. The property offers various amenities like medical facilities, a day care center, 24x7 security, water views and more."
  },
  {
    "keywords": "stylish, affordable, well ventilated, prime location, bachelors, safe & secure",
    "city": "Mumbai",
    "locality": "Thane",
    "area": 640,
    "area_unit": "Square Feet",
    "price": 2300034,
    "furnishing": "Semi-Furnished",
    "bedrooms": 2.5,
    "property_age": "6 years",
    "bathrooms": 2,
    "parking": 1,
    "facing": "north-east",
    "floor_number": 12,
    "total_floor_count": 26,
    "amenities": "24x7 security, cycle/jogging track, playing zones for children and visitors’ parking",
    "description": "Find a stylish and luxurious builder floor for rent at an affordable rate of Rs 23,00,034 with total area of 640 square feet. This well ventilated property comes with 2.5 bedrooms, 2 bathrooms and 1 parking spot, making it suitable for bachelors. The property is situated at Thane, a prime location in Mumbai and in a safe & secure neighborhood. This is a semi-furnished, north-east facing property and is in 12 floor within a building that has 26 floors in all. It is 6 years old property. There are numerous amenities available including 24x7 security, cycle/jogging track, playing zones for children and visitors’ parking."
  },
  {
    "keywords": "well-ventilated, spacious, affordable, family, working bachelors",
    "city": "Noida",
    "locality": "Sector 100",
    "area": 1250,
    "area_unit": "Square Feet",
    "price": 190003001,
    "furnishing": "Semi-Furnished",
    "bedrooms": 5,
    "property_age": "5-7 years",
    "bathrooms": 3,
    "parking": 2,
    "facing": "east",
    "floor_number": 6,
    "total_floor_count": 10,
    "amenities": "jogging cum cycling track, playing zones for children, visitors’ parking, power backup",
    "description": "Experience a well-ventilated and spacious builder floor for rent with 1250 square feet in area, at an affordable rate of Rs 19,00,03,001. The stylishly designed property offers 5 bedrooms and 3 bathrooms along with 2 parking spot as well, making it suitable for a family or even for working bachelors. The property lies in a prime location of Sector 100 in Noida which is in a safe & secure locality. This property is semi-furnished and faces east and is 5-7 years old. It is on 6th floor and has a total of 10 floors. Key amenities offered at the project include a jogging cum cycling track, playing zones for children, visitors’ parking, power backup and more."
  },
  {
    "keywords": "spacious, affordable,prime, close to public transportation",
    "city": "Mumbai",
    "locality": "Santacruz West",
    "area": 850,
    "area_unit": "Square Feet",
    "price": 52000,
    "furnishing": "Unfurnished",
    "bedrooms": 3,
    "property_age": "5-6 years",
    "bathrooms": 1,
    "parking": 2,
    "facing": "west",
    "floor_number": 6,
    "total_floor_count": 7,
    "amenities": "pet area, visitors’ parking space, power backup, jogging cum cycling track",
    "description": "Renters will appreciate this spacious builder floor offering 850 square feet of space at an affordable rent of Rs 52,000. There are 3 bedrooms in tandem with 1 bathroom and 2 parking space, making it really suitable for bachelors. The luxurious property is in a prime location at Santacruz West in Mumbai, close to public transportation. The unfurnished property which is 5-6 years old lies on the 6 floor of a building with 7 floors in total and is west facing. A pet area, visitors’ parking space, power backup and jogging cum cycling track are major amenities available here."
  }
]
