[
  {
    "keywords": "premium, affordable, investment, prime",
    "city": "Ajman",
    "locality": "Emirates City",
    "area": 790,
    "area_unit": "Square Feet",
    "price": 1200000,
    "furnishing": "Furnished",
    "office_space_type": "fitted",
    "pantry": "dry",
    "facing": "east",
    "floor_number": 4,
    "amenities": "conference room, central Wi-Fi, 24 hour security, power backup and parking for visitors",
    "description": "A premium 790 square feet furnished office space is available for sale at an affordable price point of AED 12,00,000, a fantastic investment opportunity for businesses. This is a fitted office space with an accompanying parking space as well, suitable for businesses and offices of self employed professionals alike. The prime location of Emirates City, Ajman, is what gives an added USP to this property. There is a dry pantry at this office space which faces east and the unit lies on the 4th floor. The office space is accompanied by amenities like a conference room, central Wi-Fi, 24 hour security, power backup and parking for visitors."
  },
  {
    "keywords": "breakthrough, public transportation, wide roads",
    "city": "Dubai",
    "locality": "Downtown Dubai",
    "area": 1250,
    "area_unit": "Square Feet",
    "price": 150000044,
    "furnishing": "Furnished",
    "office_space_type": "semi fitted",
    "pantry": "wet",
    "washroom_present": "yes",
    "parking": 6,
    "facing": "west",
    "floor_number": 7,
    "amenities": "24 hour security, power backup and visitors’ parking facilities",
    "description": "A 1250 square feet office space at AED 15,00,00,044 will be a breakthrough investment opportunity in such a prime location. The office space has one washroom while also offering 6 parking spaces for buyers which is hugely convenient. Downtown Dubai is a major residential, commercial and retail hub in Dubai, close to public transportation and with wide roads and thoroughfares. It is a furnished , is semi fitted and has a dry pantry. This office space is on the 7th floor and is west facing. Available amenities include 24 hour security, power backup and visitors’ parking facilities."
  },
  {
    "keywords": "elegant, prime, compelling",
    "city": "Sharjah",
    "locality": "Maryam Island",
    "area": 2110,
    "area_unit": "Square Feet",
    "price": 4000004,
    "furnishing": "Unfurnished",
    "washroom_present": "no",
    "parking": 3,
    "facing": "north",
    "floor_number": 2,
    "amenities": "24 hour security",
    "description": "An elegant 2110 square feet office space is available at a really compelling selling price of AED 40,00,004 making it an ideal option for individual buyers and companies alike. Maryam Island is a prime location in Sharjah with access to wide roads, close to public transportation facilities and availability of all necessary infrastructure and amenities. It is a unfurnished office space on the second floor and is north facing, with 3 parking. Amenities included are 24 hour security is available with this office space."
  },
  {
    "keywords": "spacious and luxurious, affordable, investment, prime",
    "city": "Ajman",
    "locality": "Ajman Corniche Road",
    "area": 990,
    "area_unit": "Square Feet",
    "price": 440000,
    "furnishing": "Semi-Furnished",
    "office_space_type": "semi fitted",
    "pantry": "wet",
    "parking": 4,
    "facing": "east",
    "floor_number": 9,
    "amenities": "conference room, central wi-fi, 24 hour security, power backup and parking for visitors",
    "description": "A spacious and luxurious 990 square feet office space is available for sale at an affordable price point of AED 4,40,000, a fantastic investment opportunity for businesses. This is a semi-furnished office space with an accompanying parking space as well, suitable for businesses and offices of self employed professionals alike. It has semi fitted space type. The prime location of Ajman Corniche Road, Ajman, is what gives an added USP to this property. There is a wet pantry at this office space with 4 parking which faces east and the unit lies on the 9th floor. The office space is accompanied by amenities like a conference room, central Wi-Fi, 24 hour security, power backup and parking for visitors."
  }
]
