[
  {
    "keywords": "enjoy, luxurious, sprawling, breakthrough, bigger families, prime",
    "city": "Pune",
    "locality": "Ashiyana Park",
    "area": 4500,
    "area_unit": "Square Feet",
    "price": 60000000,
    "furnishing": "Furnished",
    "bedrooms": 5,
    "bathrooms": 3,
    "parking": 1,
    "facing": "east",
    "property_age": "10+ years",
    "total_floor_count": 2,
    "amenities": "clubhouse, 24 hour security services, cycling cum jogging track, playing area for children, swimming pool, large green zone and balcony",
    "description": "Enjoy living in a luxurious villa across a sprawling 4,500 square feet of area and a breakthrough price point of Rs 6,00,00,000. The stylishly designed villa comes with 5 bedrooms, 3 bathrooms and 1 parking slots, making it appropriate for bigger families with kids. The prime location of Ashiyana Park in Pune is a major plus point along with the safe & secure neighborhood. The east-facing villa is approximately 10+ years old while being furnished and has a total floor count of 2. Community amenities available include a clubhouse, 24 hour security services, cycling cum jogging track, playing area for children, swimming pool, large green zone and balcony."
  },
  {
    "keywords": "stylishly, breakthrough, well-ventilated, larger families",
    "city": "Gurgaon",
    "locality": "Palam Vihar",
    "area": 173,
    "area_unit": "Square Yards",
    "price": 1850000,
    "furnishing": "Semi-Furnished",
    "bedrooms": 3,
    "bathrooms": 1,
    "parking": 2,
    "facing": "park",
    "property_age": "5-7 years",
    "total_floor_count": 5,
    "amenities": "24 hour security, built-in wardrobes, jogging cum cycling track, gymnasium, playing area for children, large green zone, power backup, squash court, water views",
    "description": "You can snap up this stylishly designed villa with 173 square yards in terms of area, at a breakthrough price of Rs 18,50,000. The well-ventilated house contains 3 bedrooms, 1 bathrooms and 2 dedicated parking space, making it suitable for larger families. The house lies in the prime location of Palam Vihar in Gurgaon, within a safe & secure neighborhood. The semi-furnished house faces the park while being 5-7 years old and have 5 floors. In spite of living in an villa, you will get access to community amenities like 24 hour security, built-in wardrobes, jogging cum cycling track, gymnasium, playing area for children, large green zone, power backup, squash court, water views and more."
  },
  {
    "keywords": "stylishly, luxurious, well-ventilated, family, ultra prime",
    "city": "kolkata",
    "locality": "sector 6",
    "area": 2150,
    "area_unit": "Square Feet",
    "price": 15000007,
    "furnishing": "Semi-Furnished",
    "bedrooms": 1.5,
    "bathrooms": 2,
    "parking": 1,
    "facing": "west",
    "property_age": "7-8 years",
    "total_floor_count": 1,
    "amenities": "24 hour security, balcony, access to gymnasium, cycling cum jogging track, medical facilities, big green zone, playing area for children",
    "description": "A stylishly designed and luxurious villa is available at a price of Rs 1,50,00,007 with 2150 square feet of area. This well-ventilated and spacious villa comes with 1.5 bedrooms, 2 bathrooms and 1 dedicated parking areas. It is ideal for a family. The property lies in a safe & secure neighborhood in the ultra prime location of sector 6 in kolkata. It is a 1 storied house that is semi-furnished and is 7-8 years old. This villa is a west facing property. Major amenities for residents at the house include 24 hour security, balcony, access to gymnasium, cycling cum jogging track, medical facilities, big green zone, playing area for children and more."
  },
  {
    "keywords": "breakthrough, dedicated, working bachelor, female, buzzing",
    "city": "Bangalore",
    "locality": "BTM Layout",
    "area": 680,
    "area_unit": "Square Feet",
    "price": 15000007,
    "furnishing": "Furnished",
    "bedrooms": 1,
    "bathrooms": 1,
    "parking": 1,
    "facing": "north-facing",
    "property_age": 3,
    "total_floor_count": 13,
    "amenities": "Power backup, central Wi-Fi, 24 hour security and a lovely water view",
    "description": "With 680 square feet of area, this villa is available at a breakthrough selling price of Rs 1,50,00,007. There is 1 bedroom and 1 bathroom along with 1 dedicated parking space as well, making it ideal for a working bachelor or female only.The property lies in the buzzing and fast-growing BTM Layout neighborhood of Bangalore while being close to public transportation. It 3 years old property is a north-facing property within a building with 13 floors. This property is also furnished for maximum convenience. Power backup, central Wi-Fi, 24 hour security and a lovely water view are key amenities at the property."
  },
  {
    "keywords": "embrace, investment opportunity, spacious",
    "city": "Gurgaon",
    "locality": "Sector 61",
    "area": 2690,
    "area_unit": "Square Feet",
    "price": 211000006,
    "furnishing": "Unfurnished",
    "bedrooms": 2,
    "bathrooms": 3,
    "parking": 1,
    "facing": "north-east",
    "property_age": "2-4 years",
    "total_floor_count": 6,
    "amenities": "24 hour security, badminton court, gymnasium, power backup, helipad, playing area for children, tennis court and swimming pool",
    "description": "Embrace a fabulous investment opportunity with this spacious villa offering 2690 square feet in area at a price of Rs 21,10,00,006. The luxurious and well-ventilated villa comes with 2 bedrooms, 3 bathrooms and 1 dedicated parking slots, making it suitable for bigger families with children. The property is in a prime location at Sector 61 in Gurgaon, within a safe & secure gated community. This is a north-east facing and unfurnished property that is around 2-4 years old with a total floor count of 6. Key amenities at the project include balconies, 24 hour security, badminton court, gymnasium, power backup, helipad, playing area for children, tennis court and swimming pool."
  }
]
